{
  "schema_version": "1.0.0",
  "source_doc": "Chuan_hoa_Du_lieu_Van_hanh_PTT.docx",
  "generated_at": "2026-08-12",
  "families": [
    {
      "dv_code": "DV01",
      "name_vi": "Hệ thống nhận diện Thương hiệu",
      "department": "Content & Social",
      "role_vi": "Tạo nền tảng định vị, sự khác biệt và tính nhất quán cho toàn bộ hoạt động marketing-bán hàng",
      "description_vi": "Xây dựng bộ nhận diện thương hiệu đầy đủ (logo, màu sắc, brand guideline, thông điệp định vị) làm nền tảng nhất quán cho toàn bộ hoạt động marketing. Giúp khách hàng có một bộ tiêu chuẩn rõ ràng để mọi kênh (website, content, ads, chatbot) giao tiếp đồng nhất, tăng khả năng ghi nhớ và tin tưởng thương hiệu.",
      "depends_on_dv": [
        "DV12"
      ],
      "process_phases": [
        {
          "week_label_vi": "Tuần 1-2",
          "ptt_work_vi": "Khám phá định vị, phân tích đối thủ, xây dựng chiến lược thương hiệu",
          "deliverable_vi": "Tài liệu định vị thương hiệu + moodboard",
          "client_action_vi": "Thông tin doanh nghiệp, mục tiêu kinh doanh, phê duyệt định hướng",
          "sort_order": 1
        },
        {
          "week_label_vi": "Tuần 3-4",
          "ptt_work_vi": "Thiết kế logo, bảng màu, bộ nhận diện cơ bản",
          "deliverable_vi": "Logo + brand guideline cơ bản",
          "client_action_vi": "Phản hồi & phê duyệt logo/bảng màu",
          "sort_order": 2
        },
        {
          "week_label_vi": "Tuần 4+ (tuỳ gói)",
          "ptt_work_vi": "Mở rộng ứng dụng nhận diện (ấn phẩm, bao bì, POSM...) theo gói Tiêu chuẩn/Chuyên sâu",
          "deliverable_vi": "Bộ ứng dụng nhận diện đầy đủ",
          "client_action_vi": "Phê duyệt từng ứng dụng trước khi hoàn thiện",
          "sort_order": 3
        }
      ],
      "kpi_defs": [
        "Brand awareness",
        "brand recall",
        "share of voice",
        "consistency score",
        "engagement rate"
      ],
      "offers": [
        {
          "tier": "CB",
          "label_vi": "Cơ bản",
          "scope_summary_vi": "Logo + bảng màu + brand guideline cơ bản",
          "price_text_vi": "15.000.000đ – 20.000.000đ",
          "duration_hint_vi": "3-4 tuần"
        },
        {
          "tier": "TC",
          "label_vi": "Tiêu chuẩn",
          "scope_summary_vi": "Bộ nhận diện đầy đủ + một số ứng dụng",
          "price_text_vi": "28.000.000đ – 40.000.000đ",
          "duration_hint_vi": "—"
        },
        {
          "tier": "CS",
          "label_vi": "Chuyên sâu",
          "scope_summary_vi": "Bộ nhận diện toàn diện + đa ứng dụng + chiến lược thương hiệu",
          "price_text_vi": "50.000.000đ – 80.000.000đ",
          "duration_hint_vi": "—"
        }
      ],
      "components": [
        {
          "component_code": "DV01-C01",
          "name_vi": "Khám phá định vị & moodboard",
          "description_vi": "Workshop định vị, phân tích đối thủ, moodboard hướng thương hiệu",
          "deliverable_vi": "Tài liệu định vị + moodboard",
          "price_text_vi": "8.000.000đ – 12.000.000đ",
          "sort_order": 1
        },
        {
          "component_code": "DV01-C02",
          "name_vi": "Thiết kế Logo",
          "description_vi": "Logo 3 phương án, chỉnh sửa và bàn giao file nguồn",
          "deliverable_vi": "Logo vector + file nguồn",
          "price_text_vi": "10.000.000đ – 15.000.000đ",
          "sort_order": 2
        },
        {
          "component_code": "DV01-C03",
          "name_vi": "Brand Guideline",
          "description_vi": "Bảng màu, typography, tone of voice, quy tắc ứng dụng cơ bản",
          "deliverable_vi": "Brand guideline PDF",
          "price_text_vi": "12.000.000đ – 18.000.000đ",
          "sort_order": 3
        },
        {
          "component_code": "DV01-C04",
          "name_vi": "Ứng dụng nhận diện",
          "description_vi": "Namecard, POSM, bao bì, ấn phẩm theo gói",
          "deliverable_vi": "Bộ ứng dụng nhận diện",
          "price_text_vi": "5.000.000đ – 25.000.000đ",
          "sort_order": 4
        }
      ],
      "bundle_by_tier": {
        "CB": [
          "DV01-C02",
          "DV01-C03"
        ],
        "TC": [
          "DV01-C01",
          "DV01-C02",
          "DV01-C03",
          "DV01-C04"
        ],
        "CS": [
          "DV01-C01",
          "DV01-C02",
          "DV01-C03",
          "DV01-C04"
        ]
      },
      "risks_vi": [
        "Định vị mơ hồ, thông điệp không nhất quán, làm đẹp hình ảnh nhưng không gắn với doanh thu.",
        "Cần áp dụng đồng bộ cho website, content, ads, chatbot để phát huy hiệu quả."
      ],
      "service_type": "one_time",
      "price_range_vi": "15tr – 80tr",
      "duration_hint_vi": "3-4 tuần+",
      "loai_hinh_vi": "One-time"
    },
    {
      "dv_code": "DV02",
      "name_vi": "Chiến lược nội dung & Mạng xã hội",
      "department": "Content & Social",
      "role_vi": "Tạo nhu cầu, giáo dục thị trường, kéo traffic và nuôi dưỡng niềm tin",
      "description_vi": "Xây dựng chiến lược nội dung và vận hành mạng xã hội theo phễu (funnel), tạo nội dung nhất quán với thương hiệu, kéo traffic và nuôi dưỡng niềm tin khách hàng qua các kênh social.",
      "depends_on_dv": [
        "DV01",
        "DV12"
      ],
      "process_phases": [
        {
          "week_label_vi": "Tuần 1-2",
          "ptt_work_vi": "Xây content pillar, lập kế hoạch nội dung theo phễu, thiết lập kênh",
          "deliverable_vi": "Kế hoạch content + lịch đăng",
          "client_action_vi": "Phê duyệt content pillar và lịch đăng",
          "sort_order": 1
        },
        {
          "week_label_vi": "Tuần 3-4",
          "ptt_work_vi": "Sản xuất & đăng batch nội dung đầu tiên",
          "deliverable_vi": "Bộ nội dung đầu tiên đã đăng",
          "client_action_vi": "Phản hồi & phê duyệt nội dung trước khi đăng",
          "sort_order": 2
        },
        {
          "week_label_vi": "Tháng 2+ (retainer)",
          "ptt_work_vi": "Vận hành liên tục, đo theo mục tiêu lead/conversion, tối ưu theo dữ liệu",
          "deliverable_vi": "Báo cáo hiệu quả hàng tháng",
          "client_action_vi": "Phê duyệt nội dung định kỳ, phản hồi hiệu quả",
          "sort_order": 3
        }
      ],
      "kpi_defs": [
        "Reach",
        "engagement rate",
        "follower growth",
        "CTR",
        "leads from social",
        "content conversion rate"
      ],
      "offers": [
        {
          "tier": "CB",
          "label_vi": "Cơ bản",
          "scope_summary_vi": "Setup + retainer nội dung cơ bản",
          "price_text_vi": "Setup 6-10tr + 7.000.000-10.000.000đ/tháng",
          "duration_hint_vi": "Bắt đầu ngay từ tháng 1"
        },
        {
          "tier": "TC",
          "label_vi": "Tiêu chuẩn",
          "scope_summary_vi": "Setup + retainer đa kênh",
          "price_text_vi": "Setup 6-10tr + 16.000.000-22.000.000đ/tháng",
          "duration_hint_vi": "—"
        },
        {
          "tier": "CS",
          "label_vi": "Chuyên sâu",
          "scope_summary_vi": "Setup + retainer toàn diện, đa nền tảng",
          "price_text_vi": "Setup 6-10tr + 30.000.000-45.000.000đ/tháng",
          "duration_hint_vi": "—"
        }
      ],
      "risks_vi": [
        "Nội dung rời rạc, chạy theo trend, không có phễu, tương tác cao nhưng không tạo lead.",
        "Cần đo theo mục tiêu lead/conversion chứ không chỉ like/share."
      ],
      "service_type": "setup_retainer",
      "price_range_vi": "Setup 6-10tr + 7-45tr/tháng",
      "duration_hint_vi": "Setup 2-4 tuần, retainer liên tục",
      "loai_hinh_vi": "Setup+Retainer",
      "components": [
        {
          "component_code": "DV02-C01",
          "name_vi": "Kế hoạch content",
          "description_vi": "Xây content pillar, lập kế hoạch nội dung theo phễu, thiết lập kênh",
          "deliverable_vi": "Kế hoạch content + lịch đăng",
          "price_text_vi": "3.000.000đ – 5.000.000đ",
          "sort_order": 1
        },
        {
          "component_code": "DV02-C02",
          "name_vi": "Bộ nội dung đầu tiên đã đăng",
          "description_vi": "Sản xuất & đăng batch nội dung đầu tiên",
          "deliverable_vi": "Bộ nội dung đầu tiên đã đăng",
          "price_text_vi": "3.000.000đ – 5.000.000đ",
          "sort_order": 2
        },
        {
          "component_code": "DV02-C03",
          "name_vi": "Báo cáo hiệu quả hàng tháng",
          "description_vi": "Vận hành liên tục, đo theo mục tiêu lead/conversion, tối ưu theo dữ liệu",
          "deliverable_vi": "Báo cáo hiệu quả hàng tháng",
          "price_text_vi": "16.000.000đ – 22.000.000đ/tháng",
          "sort_order": 3
        }
      ],
      "bundle_by_tier": {
        "CB": [
          "DV02-C01"
        ],
        "TC": [
          "DV02-C01",
          "DV02-C02"
        ],
        "CS": [
          "DV02-C01",
          "DV02-C02",
          "DV02-C03"
        ]
      }
    },
    {
      "dv_code": "DV03",
      "name_vi": "Website & Landing Page",
      "department": "Web & Ads Performance",
      "role_vi": "Là điểm chạm chuyển đổi trung tâm, nhận traffic và biến thành lead/đơn hàng",
      "description_vi": "Thiết kế và xây dựng website/landing page tối ưu chuyển đổi, gắn tracking đầy đủ ngay từ đầu, tối ưu trải nghiệm di động.",
      "depends_on_dv": [
        "DV01",
        "DV02"
      ],
      "process_phases": [
        {
          "week_label_vi": "Tuần 1-2",
          "ptt_work_vi": "Wireframe, thiết kế UI theo mục tiêu chuyển đổi",
          "deliverable_vi": "Wireframe + thiết kế UI",
          "client_action_vi": "Phê duyệt wireframe & UI",
          "sort_order": 1
        },
        {
          "week_label_vi": "Tuần 3-4",
          "ptt_work_vi": "Phát triển website/landing page, gắn tracking",
          "deliverable_vi": "Website/landing page bản build",
          "client_action_vi": "Nội dung, hình ảnh, thông tin sản phẩm",
          "sort_order": 2
        },
        {
          "week_label_vi": "Tuần 5-6 (gói cao hơn)",